{
  "$schema": "https://orknux.ai/marketplace/plugin.schema.json",
  "key": "markdown",
  "name": "Markdown",
  "author": "Orknux",
  "tags": [
    "documents",
    "text",
    "formatting",
    "chat"
  ],
  "summary": "Turn the markdown a model writes into Slack mrkdwn, or into plain text.",
  "version": "0.4.0",
  "icon": "icon.svg",
  "descriptionPath": "README.md"
}
