{
  "$schema": "https://orknux.ai/marketplace/plugin.schema.json",
  "key": "prometheus",
  "name": "Prometheus",
  "author": "Orknux",
  "tags": [
    "observability",
    "metrics",
    "monitoring"
  ],
  "summary": "Ask what the system is doing, from a condition or an agent.",
  "version": "0.5.0",
  "icon": "icon.svg",
  "descriptionPath": "README.md"
}
