{
  "$schema": "https://orknux.ai/marketplace/plugin.schema.json",
  "key": "github",
  "name": "GitHub",
  "author": "Orknux",
  "tags": [
    "source-control",
    "code-review",
    "ci",
    "agents"
  ],
  "summary": "Webhook checks, search, files, builds and comments against GitHub.",
  "version": "1.12.0",
  "icon": "icon.svg",
  "descriptionPath": "README.md"
}
